### ISSUE TITLE
fail to connect to Windows 2019 LDAP server

### ISSUE THREAD

**Issue by georgekcchung** [python-ldap/python-ldap#447]
If you found a bug in python-ldap, or would request a new feature,
this is the place to let us know.

Please describe the issue and your environment here.

---

Issue description:

My LDAP connect works well with Windows 2012 R2 LDAP connection.
When I change the connection to Windows 2019 AD server, the connection break.
The following is the tshark packet capture output.

    1 0.000000000 192.168.148.18 → 192.168.114.2 TCP 76 48844 → 389 [SYN] Seq=0 Win=64240 Len=0 MSS=1460 SACK_PERM=1 TSval=1049314707 TSecr=0 WS=128
    2 0.000346821 192.168.114.2 → 192.168.148.18 TCP 68 389 → 48844 [SYN, ACK] Seq=0 Ack=1 Win=65535 Len=0 MSS=1460 WS=256 SACK_PERM=1
    3 0.000371177 192.168.148.18 → 192.168.114.2 TCP 56 48844 → 389 [ACK] Seq=1 Ack=1 Win=64256 Len=0
    4 0.000394008 192.168.148.18 → 192.168.114.2 LDAP 87 extendedReq(1) LDAP_START_TLS_OID
    5 0.001728901 192.168.114.2 → 192.168.148.18 LDAP 187 extendedResp(1) (00000000: LdapErr: DSID-0C091338, comment: Error initializing SSL/TLS, data 0, v4563) LDAP_START_TLS_OID
    6 0.001743958 192.168.148.18 → 192.168.114.2 TCP 56 48844 → 389 [ACK] Seq=32 Ack=132 Win=64128 Len=0

If I change the connection back to Windows 2012 R2, the connection works again.

Steps to reproduce: 

Operating system: Ubuntu 20.04

Python version: 3.8.10

python-ldap version: 3.1.0

**Comment by georgekcchung** [comment]
After applying patches in Windows 2019, the problem is gone.
